{
  "id": "api-lifecycle.8d76fc9e2645ed62",
  "is_general_knowledge_record": false,
  "is_trusted_knowledge": false,
  "lifecycle": {
    "annotation_parsed": true,
    "changed_version": null,
    "deprecated_version": "8.4.0",
    "reason": "Read from the mandated Drupal core @deprecated annotation form.",
    "removed_version": "9.0.0",
    "source_annotation": "in drupal:8.4.0 and is removed from drupal:9.0.0. This is the deprecation message for deprecated_test_function().",
    "state": "deprecated"
  },
  "observed_branch": "9",
  "provenance": {
    "acquisition_channel": "external_authoritative_source",
    "authority_kind": "core_deprecation_index",
    "ingest_run_id": "api.20260908T231021.6bf7c3e6",
    "ingested_at": "2026-09-08T23:10:21Z",
    "ingested_by": {
      "name": "drupal-knowledge-api-lifecycle-engine",
      "version": "0.1"
    },
    "source_id": "drupal-api-deprecated-9-p1",
    "source_snapshot_sha256": "sha256:b4732697f35f5875305eb01427b753d902c47e297f9f741e905d52e8f83decb8",
    "source_url": "https://api.drupal.org/api/drupal/deprecated/9"
  },
  "record_class": "source_derived_authoritative_api_lifecycle_record",
  "record_contract_version": "0.1",
  "replacement": {
    "semantics": "A replacement is recorded only when the annotation states one. An equivalent API is never inferred.",
    "state": "unknown",
    "value": null
  },
  "symbol": {
    "class": null,
    "core_file": "core/modules/system/tests/modules/deprecation_test/deprecation_test.module",
    "identity_basis": "global_procedural_function",
    "index_name": "deprecation_test_function",
    "kind": "function",
    "matchable": true,
    "member": null,
    "qualified_name": "deprecation_test_function"
  }
}
