{
  "id": "api-lifecycle.5753a1268fd3733a",
  "is_general_knowledge_record": false,
  "is_trusted_knowledge": false,
  "lifecycle": {
    "annotation_parsed": true,
    "changed_version": null,
    "deprecated_version": "9.1.0",
    "reason": "Read from the mandated Drupal core @deprecated annotation form.",
    "removed_version": "10.0.0",
    "source_annotation": "in drupal:9.1.0 and is removed from drupal:10.0.0. No direct replacement is provided.",
    "state": "deprecated"
  },
  "observed_branch": "9",
  "provenance": {
    "acquisition_channel": "external_authoritative_source",
    "authority_kind": "core_deprecation_index",
    "ingest_run_id": "api.20260908T231021.6bf7c3e6",
    "ingested_at": "2026-09-08T23:10:21Z",
    "ingested_by": {
      "name": "drupal-knowledge-api-lifecycle-engine",
      "version": "0.1"
    },
    "source_id": "drupal-api-deprecated-9-p3",
    "source_snapshot_sha256": "sha256:322ca48f208aaa048e06628a58371515c74386c9079123679eecd1687e8a477f",
    "source_url": "https://api.drupal.org/api/drupal/deprecated/9"
  },
  "record_class": "source_derived_authoritative_api_lifecycle_record",
  "record_contract_version": "0.1",
  "replacement": {
    "semantics": "A replacement is recorded only when the annotation states one. An equivalent API is never inferred.",
    "state": "unknown",
    "value": null
  },
  "symbol": {
    "class": "Drupal\\Core\\Routing\\RouteProviderLazyBuilder",
    "core_file": "core/lib/Drupal/Core/Routing/RouteProviderLazyBuilder.php",
    "identity_basis": "core_file_path_psr4",
    "index_name": "RouteProviderLazyBuilder::getRoutesPaged",
    "kind": "method",
    "matchable": true,
    "member": "getRoutesPaged",
    "qualified_name": "Drupal\\Core\\Routing\\RouteProviderLazyBuilder::getRoutesPaged"
  }
}
